{
  "schema_version": "result/v1",
  "slug": "circle-packing-26-unit-square",
  "title": "26-circle unit-square packing",
  "domain": "Geometric Optimization",
  "status": "published",
  "published_at": "2026-05-20",
  "summary": "A deterministic 26-circle packing in the unit square reaches a validated total radius of 2.635977. The public result exposes the geometry, the validation contract, and the curated best-so-far chain that found it.",
  "problem_statement": "Find 26 non-overlapping circles inside the unit square that maximize the sum of radii while every circle stays inside the boundary and the public entrypoint remains deterministic.",
  "evaluation_contract": {
    "summary": "Candidates return exactly 26 centers, 26 positive radii, and a reported sum. The evaluator checks finite values, sum consistency, unit-square containment, pairwise non-overlap, and deterministic repeat calls; the score is the negative total radius, so lower is better.",
    "artifact": "artifacts/evaluation_contract.md"
  },
  "metrics": {
    "seed": -0.9597783591318301,
    "best": -2.6359773947541023,
    "improvement": 1.6761990356222722,
    "improvement_pct": 174.64438739153093,
    "units": "score",
    "direction": "lower_is_better",
    "validation_status": "contact-system-construction",
    "seed_sum_radii": 0.9597783591318301,
    "accepted_sum_radii": 2.6359773947541023,
    "sum_radii_gain": 1.6761990356222722,
    "known_target_sum_radii": 2.635,
    "known_target_gap": 0.0,
    "circle_count": 26,
    "valid_rate": 1,
    "boundary_contact_count": 20,
    "pairwise_contact_count": 58,
    "interior_circle_count": 10,
    "min_radius": 0.06935728482282306,
    "max_radius": 0.13512828357180387,
    "mean_radius": 0.10138374595208086,
    "validity_margin": -1.757760603737779e-13
  },
  "artifacts": {
    "candidate_code": "artifacts/accepted_candidate.py",
    "evolution_trace": "artifacts/evolution.json",
    "metrics": "artifacts/metrics.json",
    "provenance": "artifacts/provenance.json",
    "reference_comparison": "artifacts/reference-comparison.json",
    "replay": "artifacts/replay.json",
    "score_trace": "artifacts/score-trace.json",
    "plots": [
      "assets/objective-curve.svg",
      "assets/packing-layout.svg",
      "assets/contact-readout.svg"
    ]
  },
  "website": {
    "order": 3,
    "card_label": "03 Geometric Optimization",
    "card_summary": "A 26-circle unit-square packing is validated as a deterministic geometry artifact, with the public chain and contact structure exposed.",
    "card_visual": "circle-packing",
    "card_metrics": [
      {
        "label": "Validated sum radii",
        "value": "2.635977"
      },
      {
        "label": "Improvement from baseline",
        "value": "+174.64%"
      }
    ],
    "detail_path": "results/circle-packing-26-unit-square/",
    "surface_path": "results/circle-packing-26-unit-square/run/",
    "display_labels": {
      "seed": "Baseline score",
      "best": "Accepted score",
      "improvement": "Score reduction"
    },
    "figure_captions": {
      "assets/objective-curve.svg": "Scored public candidates and best-so-far total radius.",
      "assets/packing-layout.svg": "Accepted 26-circle packing in the unit square.",
      "assets/contact-readout.svg": "Boundary and pairwise contact diagnostics for the accepted packing."
    },
    "score_note": "The evaluator score is negative total radius. The report also shows sum radii directly because that is the geometric objective readers inspect."
  }
}
